{
  "schema_version": "1.0.0", "record_type": "release", "id": "gls:release:3a99d120-a2dd-4e79-9a10-74b47aeefc03", "work_id": "gls:work:54a52e52-dfbd-4922-8c04-ec02f7fae943",
  "version": "0.4.0+d6290c6", "title": "SISO Project OS pinned seed", "released_at": "2026-07-29T15:38:19Z", "observed_at": "2026-07-29", "immutable": true,
  "artifacts": [{
    "id": "gls:artifact:14da3d20-faaa-4d79-90ee-11e608a2e101", "kind": "source_archive", "locator": "https://github.com/sisodias/siso-project-os/archive/d6290c609a6922e14b3faa27019aae31628686cb.tar.gz", "revision": "d6290c609a6922e14b3faa27019aae31628686cb", "availability": "public", "owner": "sisodias", "ownership": "siso",
    "license": { "status": "verified", "spdx": "MIT", "reason": "Public repository metadata reports MIT.", "evidence": [{ "kind": "integration_check", "reference": "https://github.com/sisodias/siso-project-os", "observed_at": "2026-07-29", "summary": "Repository visibility and license verified." }] },
    "integrity": { "state": "verified", "algorithm": "git_commit_sha1", "digest": "d6290c609a6922e14b3faa27019aae31628686cb" }
  }],
  "distribution": {
    "addressable": { "state": "verified", "reason": "The public source is pinned to an exact commit.", "evidence": [{ "kind": "integration_check", "reference": "https://github.com/sisodias/siso-project-os/commit/d6290c609a6922e14b3faa27019aae31628686cb", "observed_at": "2026-07-29", "summary": "Commit resolved as main HEAD." }] },
    "archive_downloadable": { "state": "verified", "reason": "A public commit-scoped archive locator is recorded.", "evidence": [{ "kind": "public_locator", "reference": "https://github.com/sisodias/siso-project-os/archive/d6290c609a6922e14b3faa27019aae31628686cb.tar.gz", "observed_at": "2026-07-29", "summary": "Archive locator is immutable by commit pin." }] },
    "manifest_resolvable": { "state": "verified", "reason": "The registry release resolves to its Work and pinned artifact.", "evidence": [{ "kind": "registry_validation", "reference": "registry:release:siso-project-os-d6290c6", "observed_at": "2026-07-29", "summary": "Manifest cross-references validated." }] },
    "installable": { "state": "experimental", "reason": "Source-backed install commands exist, but this exact pin has no independent install receipt in the Library.", "evidence": [{ "kind": "source_review", "reference": "source-review:project-os-agent-story:2026-07-29", "observed_at": "2026-07-29", "summary": "Installation contract and Node 20 requirement reviewed." }] },
    "forkable": { "state": "verified", "reason": "The source repository is public and MIT licensed.", "evidence": [{ "kind": "integration_check", "reference": "https://github.com/sisodias/siso-project-os", "observed_at": "2026-07-29", "summary": "Public visibility and MIT license verified." }] },
    "portable": { "state": "experimental", "reason": "The bundle is designed for project-local adoption, but portability of this exact pin has not been independently exercised.", "evidence": [{ "kind": "source_review", "reference": "source-review:project-os-agent-story:2026-07-29", "observed_at": "2026-07-29", "summary": "Clean project-local boundary reviewed." }] }
  },
  "evidence": [{ "kind": "integration_check", "reference": "github-api:sisodias/siso-project-os:d6290c609a6922e14b3faa27019aae31628686cb", "observed_at": "2026-07-29", "summary": "Current public main HEAD pinned at the supplied commit and timestamp." }]
}
