{
  "schema_version": "1.0.0",
  "record_type": "release",
  "id": "gls:release:3da753a0-ffd2-467c-a2ca-5dfd712ba86f",
  "work_id": "gls:work:9b18cc64-7d5e-4f30-b63d-a0ec30c1f7e1",
  "version": "0.3.1+2bd415d",
  "title": "Great Library repository header release",
  "released_at": "2026-07-30T21:09:28+07:00",
  "observed_at": "2026-07-30",
  "immutable": true,
  "artifacts": [
    {
      "id": "gls:artifact:ba40eee6-6ebd-499b-92c4-7fe838c9f06f",
      "kind": "source_archive",
      "locator": "https://github.com/Lordsisodia/great-library-of-siso/archive/2bd415dd3024c928fc8414b891e7f21069c3fcaa.tar.gz",
      "revision": "2bd415dd3024c928fc8414b891e7f21069c3fcaa",
      "availability": "public",
      "owner": "Lordsisodia",
      "ownership": "siso",
      "license": {
        "status": "verified",
        "spdx": "MIT",
        "reason": "The pinned public registry source carries an MIT license.",
        "evidence": [
          {
            "kind": "source_review",
            "reference": "https://github.com/Lordsisodia/great-library-of-siso/blob/2bd415dd3024c928fc8414b891e7f21069c3fcaa/LICENSE",
            "observed_at": "2026-07-30",
            "summary": "MIT license is present in the pinned source release."
          }
        ]
      },
      "integrity": {
        "state": "verified",
        "algorithm": "git_commit_sha1",
        "digest": "2bd415dd3024c928fc8414b891e7f21069c3fcaa"
      }
    }
  ],
  "distribution": {
    "addressable": {
      "state": "verified",
      "reason": "The public registry source is pinned to an exact commit.",
      "evidence": [
        {
          "kind": "integration_check",
          "reference": "https://github.com/Lordsisodia/great-library-of-siso/commit/2bd415dd3024c928fc8414b891e7f21069c3fcaa",
          "observed_at": "2026-07-30",
          "summary": "Published source commit resolves from the canonical repository."
        }
      ]
    },
    "archive_downloadable": {
      "state": "verified",
      "reason": "A public commit-scoped source archive is recorded.",
      "evidence": [
        {
          "kind": "public_locator",
          "reference": "https://github.com/Lordsisodia/great-library-of-siso/archive/2bd415dd3024c928fc8414b891e7f21069c3fcaa.tar.gz",
          "observed_at": "2026-07-30",
          "summary": "Archive locator is immutable by commit pin."
        }
      ]
    },
    "manifest_resolvable": {
      "state": "verified",
      "reason": "The registry validates the Knowledge Work, exact Release, source inventory, V19 Snapshot, schemas, generated site, links, and publication safety.",
      "evidence": [
        {
          "kind": "registry_validation",
          "reference": "repo-check:great-library-of-siso:2bd415dd3024c928fc8414b891e7f21069c3fcaa",
          "observed_at": "2026-07-30",
          "summary": "All Great Library checks passed with sixteen Works and nineteen Snapshots."
        }
      ]
    },
    "installable": {
      "state": "verified",
      "reason": "A clean Node install can deterministically build and verify the static publication.",
      "evidence": [
        {
          "kind": "release_receipt",
          "reference": "repo-check:great-library-of-siso:2bd415dd3024c928fc8414b891e7f21069c3fcaa",
          "observed_at": "2026-07-30",
          "summary": "Registry, build, local-link, identity, and publication checks passed."
        }
      ]
    },
    "forkable": {
      "state": "verified",
      "reason": "The registry repository is public, source-complete, machine-readable, and MIT licensed.",
      "evidence": [
        {
          "kind": "integration_check",
          "reference": "https://github.com/Lordsisodia/great-library-of-siso",
          "observed_at": "2026-07-30",
          "summary": "Public source, schemas, generators, docs, registry records, verification, onboarding, and license are present."
        }
      ]
    },
    "portable": {
      "state": "verified",
      "reason": "The registry builds to static files and deploys to a stable Vercel alias without a stateful backend.",
      "evidence": [
        {
          "kind": "release_receipt",
          "reference": "repo-check:great-library-of-siso:2bd415dd3024c928fc8414b891e7f21069c3fcaa",
          "observed_at": "2026-07-30",
          "summary": "The Knowledge boundary is represented entirely through public, machine-neutral records and generated static pages."
        }
      ]
    }
  },
  "evidence": [
    {
      "kind": "release_receipt",
      "reference": "repo-check:great-library-2bd415d",
      "observed_at": "2026-07-30",
      "summary": "The verified Great Library source now includes the flagship repository header while preserving the registry, generated site, and publication contracts."
    }
  ]
}
