{
  "schema_version": "1.0.0",
  "record_type": "release",
  "id": "gls:release:5b98d150-b81e-477a-848a-b22564b1e177",
  "work_id": "gls:work:9b18cc64-7d5e-4f30-b63d-a0ec30c1f7e1",
  "version": "0.3.0+2772212",
  "title": "Great Library SISO Knowledge boundary",
  "released_at": "2026-07-30T20:56:33+07:00",
  "observed_at": "2026-07-30",
  "immutable": true,
  "artifacts": [{
    "id": "gls:artifact:b20481b6-a0e3-4c2f-ba2b-7d5bec2d88f0",
    "kind": "source_archive",
    "locator": "https://github.com/Lordsisodia/great-library-of-siso/archive/2772212fdcf7efdd5789c05c241570e9ec43e2a1.tar.gz",
    "revision": "2772212fdcf7efdd5789c05c241570e9ec43e2a1",
    "availability": "public",
    "owner": "Lordsisodia",
    "ownership": "siso",
    "license": {
      "status": "verified",
      "spdx": "MIT",
      "reason": "The pinned public registry source carries an MIT license.",
      "evidence": [{ "kind": "source_review", "reference": "https://github.com/Lordsisodia/great-library-of-siso/blob/2772212fdcf7efdd5789c05c241570e9ec43e2a1/LICENSE", "observed_at": "2026-07-30", "summary": "MIT license is present in the pinned source release." }]
    },
    "integrity": { "state": "verified", "algorithm": "git_commit_sha1", "digest": "2772212fdcf7efdd5789c05c241570e9ec43e2a1" }
  }],
  "distribution": {
    "addressable": { "state": "verified", "reason": "The public registry source is pinned to an exact commit.", "evidence": [{ "kind": "integration_check", "reference": "https://github.com/Lordsisodia/great-library-of-siso/commit/2772212fdcf7efdd5789c05c241570e9ec43e2a1", "observed_at": "2026-07-30", "summary": "Published source commit resolves from the canonical repository." }] },
    "archive_downloadable": { "state": "verified", "reason": "A public commit-scoped source archive is recorded.", "evidence": [{ "kind": "public_locator", "reference": "https://github.com/Lordsisodia/great-library-of-siso/archive/2772212fdcf7efdd5789c05c241570e9ec43e2a1.tar.gz", "observed_at": "2026-07-30", "summary": "Archive locator is immutable by commit pin." }] },
    "manifest_resolvable": { "state": "verified", "reason": "The registry validates the Knowledge Work, exact Release, source inventory, V19 Snapshot, schemas, generated site, links, and publication safety.", "evidence": [{ "kind": "registry_validation", "reference": "repo-check:great-library-of-siso:2772212fdcf7efdd5789c05c241570e9ec43e2a1", "observed_at": "2026-07-30", "summary": "All Great Library checks passed with sixteen Works and nineteen Snapshots." }] },
    "installable": { "state": "verified", "reason": "A clean Node install can deterministically build and verify the static publication.", "evidence": [{ "kind": "release_receipt", "reference": "repo-check:great-library-of-siso:2772212fdcf7efdd5789c05c241570e9ec43e2a1", "observed_at": "2026-07-30", "summary": "Registry, build, local-link, identity, and publication checks passed." }] },
    "forkable": { "state": "verified", "reason": "The registry repository is public, source-complete, machine-readable, and MIT licensed.", "evidence": [{ "kind": "integration_check", "reference": "https://github.com/Lordsisodia/great-library-of-siso", "observed_at": "2026-07-30", "summary": "Public source, schemas, generators, docs, registry records, verification, onboarding, and license are present." }] },
    "portable": { "state": "verified", "reason": "The registry builds to static files and deploys to a stable Vercel alias without a stateful backend.", "evidence": [{ "kind": "release_receipt", "reference": "repo-check:great-library-of-siso:2772212fdcf7efdd5789c05c241570e9ec43e2a1", "observed_at": "2026-07-30", "summary": "The Knowledge boundary is represented entirely through public, machine-neutral records and generated static pages." }] }
  },
  "evidence": [
    { "kind": "integration_check", "reference": "github-api:Lordsisodia/great-library-of-siso:2772212fdcf7efdd5789c05c241570e9ec43e2a1", "observed_at": "2026-07-30", "summary": "Canonical public main HEAD was pinned after publication of the SISO Knowledge Work, release, source inventory, model document, and V19 selection." },
    { "kind": "release_receipt", "reference": "repo-check:great-library-of-siso:2772212fdcf7efdd5789c05c241570e9ec43e2a1", "observed_at": "2026-07-30", "summary": "Registry validation, static generation, links, exact attribution, and publication scans passed before the source commit was selected." }
  ]
}
