{
  "schema_version": "1.0.0",
  "record_type": "release",
  "id": "gls:release:283f0d30-ec5d-41a1-bbbe-df548371cab2",
  "work_id": "gls:work:9b18cc64-7d5e-4f30-b63d-a0ec30c1f7e1",
  "version": "0.2.1+fd348bc",
  "title": "Great Library Agents workspace layout",
  "released_at": "2026-07-30T20:04:51+07:00",
  "observed_at": "2026-07-30",
  "immutable": true,
  "artifacts": [{
    "id": "gls:artifact:6ee4aff1-bb9d-436e-89f3-2a7c115e4d73",
    "kind": "source_archive",
    "locator": "https://github.com/Lordsisodia/great-library-of-siso/archive/fd348bc40c010d1964eee98c5c6b0e6035edaa62.tar.gz",
    "revision": "fd348bc40c010d1964eee98c5c6b0e6035edaa62",
    "availability": "public",
    "owner": "Lordsisodia",
    "ownership": "siso",
    "license": {
      "status": "verified",
      "spdx": "MIT",
      "reason": "The pinned public registry source carries an MIT license.",
      "evidence": [{"kind":"source_review","reference":"https://github.com/Lordsisodia/great-library-of-siso/blob/fd348bc40c010d1964eee98c5c6b0e6035edaa62/LICENSE","observed_at":"2026-07-30","summary":"MIT license is present in the pinned source release."}]
    },
    "integrity": {"state":"verified","algorithm":"git_commit_sha1","digest":"fd348bc40c010d1964eee98c5c6b0e6035edaa62"}
  }],
  "distribution": {
    "addressable": {"state":"verified","reason":"The public registry source is pinned to an exact commit.","evidence":[{"kind":"integration_check","reference":"https://github.com/Lordsisodia/great-library-of-siso/commit/fd348bc40c010d1964eee98c5c6b0e6035edaa62","observed_at":"2026-07-30","summary":"Published source commit resolves from the canonical repository."}]},
    "archive_downloadable": {"state":"verified","reason":"A public commit-scoped source archive is recorded.","evidence":[{"kind":"public_locator","reference":"https://github.com/Lordsisodia/great-library-of-siso/archive/fd348bc40c010d1964eee98c5c6b0e6035edaa62.tar.gz","observed_at":"2026-07-30","summary":"Archive locator is immutable by commit pin."}]},
    "manifest_resolvable": {"state":"verified","reason":"The registry validates its schemas, records, generated site, links, and publication safety.","evidence":[{"kind":"registry_validation","reference":"repo-check:great-library-of-siso:fd348bc40c010d1964eee98c5c6b0e6035edaa62","observed_at":"2026-07-30","summary":"Registry validation and machine catalog generation passed."}]},
    "installable": {"state":"verified","reason":"A clean Node install can deterministically build and verify the static publication.","evidence":[{"kind":"release_receipt","reference":"repo-check:great-library-of-siso:fd348bc40c010d1964eee98c5c6b0e6035edaa62","observed_at":"2026-07-30","summary":"Build, local link contract, identity attribution, and publication scan passed."}]},
    "forkable": {"state":"verified","reason":"The repository is public, source-complete, machine-readable, and MIT licensed.","evidence":[{"kind":"integration_check","reference":"https://github.com/Lordsisodia/great-library-of-siso","observed_at":"2026-07-30","summary":"Public source, schemas, generators, docs, registry records, verification, onboarding, and license are present."}]},
    "portable": {"state":"verified","reason":"The registry builds to static files and deploys to a stable Vercel alias without a stateful backend.","evidence":[{"kind":"release_receipt","reference":"vercel:great-library-of-siso:production:2026-07-30","observed_at":"2026-07-30","summary":"Production deployment uses the generated static site and stable public alias."}]}
  },
  "evidence": [
    {"kind":"integration_check","reference":"github-api:Lordsisodia/great-library-of-siso:fd348bc40c010d1964eee98c5c6b0e6035edaa62","observed_at":"2026-07-30","summary":"Canonical public main HEAD was pinned after publication of the machine-neutral SISO Agents workspace layout."},
    {"kind":"release_receipt","reference":"repo-check:great-library-of-siso:fd348bc40c010d1964eee98c5c6b0e6035edaa62","observed_at":"2026-07-30","summary":"Registry, static site, Agents layout documentation, links, attribution, and publication checks passed."}
  ]
}

