{
  "schema_version": "1.0.0", "record_type": "release", "id": "gls:release:993e1242-04c8-4d0b-870a-67d91fa89cbf", "work_id": "gls:work:231aab36-e763-4374-bc94-3a09fd3bf49f",
  "version": "registry-seed-2026-07-30", "title": "SISO Evidence Engines metadata seed", "released_at": "2026-07-30T01:15:00Z", "observed_at": "2026-07-30", "immutable": true, "artifacts": [],
  "distribution": {
    "addressable": { "state": "verified", "reason": "The Work and public staging home are addressable.", "evidence": [{ "kind": "integration_check", "reference": "https://github.com/Lordsisodia/siso-evidence-engines", "observed_at": "2026-07-30", "summary": "Canonical staging repository and stable Library Work resolve." }] },
    "archive_downloadable": { "state": "unavailable", "reason": "No code-only engine archive has been published.", "evidence": [] },
    "manifest_resolvable": { "state": "verified", "reason": "The metadata manifest resolves inside the registry.", "evidence": [{ "kind": "registry_validation", "reference": "registry:release:siso-evidence-engines-seed", "observed_at": "2026-07-30", "summary": "Release-to-Work reference validated." }] },
    "installable": { "state": "unavailable", "reason": "Reusable packages remain mixed with data and machine state in the warehouse.", "evidence": [] },
    "forkable": { "state": "unavailable", "reason": "The staging repository does not yet contain licensed source.", "evidence": [] },
    "portable": { "state": "unavailable", "reason": "No independent package receipts exist.", "evidence": [] }
  },
  "evidence": [{ "kind": "source_review", "reference": "source-review:siso-agent-base-modules:evidence-engines:2026-07-30", "observed_at": "2026-07-30", "summary": "Metadata release establishes the package family without publishing private corpora or generated state." }]
}
