{
  "schema_version": "1.0.0", "record_type": "release", "id": "gls:release:b81851e9-e4e1-468e-b3d3-1cd303bd7877", "work_id": "gls:work:5af5cab4-13d9-48c4-b15c-8c31ba3db10b",
  "version": "registry-seed-2026-07-30", "title": "SISO Agent Brain metadata seed", "released_at": "2026-07-30T01:15:00Z", "observed_at": "2026-07-30", "immutable": true, "artifacts": [],
  "distribution": {
    "addressable": { "state": "verified", "reason": "The Work and public staging home are addressable.", "evidence": [{ "kind": "integration_check", "reference": "https://github.com/Lordsisodia/siso-agent-brain", "observed_at": "2026-07-30", "summary": "Canonical staging repository and stable Library Work resolve." }] },
    "archive_downloadable": { "state": "unavailable", "reason": "No source release archive has been published.", "evidence": [] },
    "manifest_resolvable": { "state": "verified", "reason": "The metadata manifest resolves inside the registry.", "evidence": [{ "kind": "registry_validation", "reference": "registry:release:siso-agent-brain-seed", "observed_at": "2026-07-30", "summary": "Release-to-Work reference validated." }] },
    "installable": { "state": "unavailable", "reason": "Machine-specific service source has not completed public extraction.", "evidence": [] },
    "forkable": { "state": "unavailable", "reason": "The staging repository does not yet contain licensed source.", "evidence": [] },
    "portable": { "state": "unavailable", "reason": "No public configuration or portability receipt exists.", "evidence": [] }
  },
  "evidence": [{ "kind": "source_review", "reference": "source-review:siso-agent-base-modules:brain-service:2026-07-30", "observed_at": "2026-07-30", "summary": "Metadata release makes no source availability claim while the service is sanitized." }]
}
