{
  "schema_version": "1.0.0",
  "record_type": "release",
  "id": "gls:release:07f984fa-af0a-422a-9103-6e34a2ac6dbd",
  "work_id": "gls:work:9b18cc64-7d5e-4f30-b63d-a0ec30c1f7e1",
  "version": "0.8.0+d16ac75",
  "title": "God Questions infrastructure dogfood",
  "released_at": "2026-08-02T00:12:29+07:00",
  "observed_at": "2026-08-02",
  "immutable": true,
  "artifacts": [
    {
      "id": "gls:artifact:7b099cd1-00e6-41c0-9c7a-a881e118c5ca",
      "kind": "source_archive",
      "locator": "https://github.com/Lordsisodia/great-library-of-siso/archive/d16ac75d98849dfb62e2e684e3d02b65132a25c5.tar.gz",
      "revision": "d16ac75d98849dfb62e2e684e3d02b65132a25c5",
      "availability": "public",
      "owner": "Lordsisodia",
      "ownership": "siso",
      "license": {
        "status": "verified",
        "spdx": "MIT",
        "reason": "The pinned public registry source carries an MIT license.",
        "evidence": [
          {
            "kind": "source_review",
            "reference": "https://github.com/Lordsisodia/great-library-of-siso/blob/d16ac75d98849dfb62e2e684e3d02b65132a25c5/LICENSE",
            "observed_at": "2026-08-02",
            "summary": "The MIT license is present in the pinned source release."
          }
        ]
      },
      "integrity": {
        "state": "verified",
        "algorithm": "git_commit_sha1",
        "digest": "d16ac75d98849dfb62e2e684e3d02b65132a25c5"
      }
    }
  ],
  "distribution": {
    "addressable": {
      "state": "verified",
      "reason": "The public God Questions infrastructure implementation is pinned to an exact commit.",
      "evidence": [
        {
          "kind": "integration_check",
          "reference": "https://github.com/Lordsisodia/great-library-of-siso/commit/d16ac75d98849dfb62e2e684e3d02b65132a25c5",
          "observed_at": "2026-08-02",
          "summary": "The published implementation commit resolves from the canonical repository."
        }
      ]
    },
    "archive_downloadable": {
      "state": "verified",
      "reason": "A public commit-scoped source archive is recorded.",
      "evidence": [
        {
          "kind": "public_locator",
          "reference": "https://github.com/Lordsisodia/great-library-of-siso/archive/d16ac75d98849dfb62e2e684e3d02b65132a25c5.tar.gz",
          "observed_at": "2026-08-02",
          "summary": "The archive locator is immutable by commit pin."
        }
      ]
    },
    "manifest_resolvable": {
      "state": "verified",
      "reason": "The generated Research surface resolves GQ-009 and the richer question-program contract from canonical registry records.",
      "evidence": [
        {
          "kind": "registry_validation",
          "reference": "repo-check:god-questions-infrastructure:d16ac75",
          "observed_at": "2026-08-02",
          "summary": "The full gate passed with a seven-question Observatory and a generated GQ-009 detail contract."
        }
      ]
    },
    "installable": {
      "state": "verified",
      "reason": "A clean Node installation deterministically validates and builds the static Library surface.",
      "evidence": [
        {
          "kind": "release_receipt",
          "reference": "repo-check:god-questions-infrastructure:d16ac75",
          "observed_at": "2026-08-02",
          "summary": "All Great Library checks passed, including four research-contract fixtures."
        }
      ]
    },
    "forkable": {
      "state": "verified",
      "reason": "The repository is public, source-complete, machine-readable, and MIT licensed.",
      "evidence": [
        {
          "kind": "integration_check",
          "reference": "https://github.com/Lordsisodia/great-library-of-siso",
          "observed_at": "2026-08-02",
          "summary": "The Work, Release, Snapshot, schema, generator, tests, and generated page are public."
        }
      ]
    },
    "portable": {
      "state": "verified",
      "reason": "The Observatory depends only on public registry state and generated static content.",
      "evidence": [
        {
          "kind": "release_receipt",
          "reference": "repo-check:god-questions-infrastructure:d16ac75",
          "observed_at": "2026-08-02",
          "summary": "Publication and machine-path safety checks passed."
        }
      ]
    }
  },
  "evidence": [
    {
      "kind": "release_receipt",
      "reference": "repo-check:god-questions-infrastructure:d16ac75",
      "observed_at": "2026-08-02",
      "summary": "GQ-009 dogfoods the existing question architecture; the generated Observatory exposes portfolio state and the richer program fields without creating a second registry or execution authority."
    }
  ]
}
