{
  "schema_version": "1.0.0", "record_type": "release", "id": "gls:release:61f81c21-b467-4628-96e8-a20493cd0a04", "work_id": "gls:work:b584bbf7-acde-46a2-b33e-e430ee1df224",
  "version": "main+2e2edfe", "title": "SISO Agent Base pinned seed", "released_at": "2026-07-18T20:13:04Z", "observed_at": "2026-07-29", "immutable": true,
  "artifacts": [{
    "id": "gls:artifact:25eb4e31-abbb-4e8a-a1ff-22f719b3f202", "kind": "source_archive", "locator": "https://github.com/Lordsisodia/siso-agent-base/archive/2e2edfe7a820617557fcff093a348dc0bb4fb040.tar.gz", "revision": "2e2edfe7a820617557fcff093a348dc0bb4fb040", "availability": "public", "owner": "Lordsisodia", "ownership": "siso",
    "license": { "status": "verified", "spdx": "MIT", "reason": "Public repository metadata reports MIT.", "evidence": [{ "kind": "integration_check", "reference": "https://github.com/Lordsisodia/siso-agent-base", "observed_at": "2026-07-29", "summary": "Repository visibility and license verified." }] },
    "integrity": { "state": "verified", "algorithm": "git_commit_sha1", "digest": "2e2edfe7a820617557fcff093a348dc0bb4fb040" }
  }],
  "distribution": {
    "addressable": { "state": "verified", "reason": "The public source is pinned to an exact commit.", "evidence": [{ "kind": "integration_check", "reference": "https://github.com/Lordsisodia/siso-agent-base/commit/2e2edfe7a820617557fcff093a348dc0bb4fb040", "observed_at": "2026-07-29", "summary": "Commit resolved as main HEAD." }] },
    "archive_downloadable": { "state": "verified", "reason": "A public commit-scoped archive locator is recorded.", "evidence": [{ "kind": "public_locator", "reference": "https://github.com/Lordsisodia/siso-agent-base/archive/2e2edfe7a820617557fcff093a348dc0bb4fb040.tar.gz", "observed_at": "2026-07-29", "summary": "Archive locator is immutable by commit pin." }] },
    "manifest_resolvable": { "state": "verified", "reason": "The registry release resolves to its Work and pinned artifact.", "evidence": [{ "kind": "registry_validation", "reference": "registry:release:siso-agent-base-2e2edfe", "observed_at": "2026-07-29", "summary": "Manifest cross-references validated." }] },
    "installable": { "state": "experimental", "reason": "A public installer is documented, but this exact pin has no independent install receipt in the Library.", "evidence": [{ "kind": "source_review", "reference": "source-review:agent-base-modules-story:2026-07-29", "observed_at": "2026-07-29", "summary": "Installer and coupled runtime release boundary reviewed." }] },
    "forkable": { "state": "verified", "reason": "The source repository is public and MIT licensed.", "evidence": [{ "kind": "integration_check", "reference": "https://github.com/Lordsisodia/siso-agent-base", "observed_at": "2026-07-29", "summary": "Public visibility and MIT license verified." }] },
    "portable": { "state": "experimental", "reason": "The public framework is coupled to runtime and provider assumptions that still need a portability receipt.", "evidence": [{ "kind": "source_review", "reference": "source-review:agent-base-modules-story:2026-07-29", "observed_at": "2026-07-29", "summary": "Runtime coupling and portability gaps reviewed." }] }
  },
  "evidence": [{ "kind": "integration_check", "reference": "github-api:Lordsisodia/siso-agent-base:2e2edfe7a820617557fcff093a348dc0bb4fb040", "observed_at": "2026-07-29", "summary": "Current public main HEAD pinned at the supplied commit and timestamp." }]
}
