{
  "schema_version":"1.0.0","record_type":"release","id":"gls:release:941effe9-a115-41a9-bfde-d681ebc45812","work_id":"gls:work:5af5cab4-13d9-48c4-b15c-8c31ba3db10b",
  "version":"0.3.0+ed50bec","title":"SISO Agent Brain conservative legacy import release","released_at":"2026-07-30T12:26:31+07:00","observed_at":"2026-07-30","immutable":true,
  "artifacts":[{"id":"gls:artifact:40538478-0692-4513-bb33-6520578c70b2","kind":"source_archive","locator":"https://github.com/Lordsisodia/siso-agent-brain/archive/ed50bec86f5cfb86cc5c84ebfce97fad595598b4.tar.gz","revision":"ed50bec86f5cfb86cc5c84ebfce97fad595598b4","availability":"public","owner":"Lordsisodia","ownership":"siso","license":{"status":"verified","spdx":"MIT","reason":"The SISO-owned Agent Brain source carries MIT.","evidence":[{"kind":"source_review","reference":"https://github.com/Lordsisodia/siso-agent-brain/blob/ed50bec86f5cfb86cc5c84ebfce97fad595598b4/LICENSE","observed_at":"2026-07-30","summary":"MIT license text is present at the exact release pin."}]},"integrity":{"state":"verified","algorithm":"git_commit_sha1","digest":"ed50bec86f5cfb86cc5c84ebfce97fad595598b4"}}],
  "distribution":{
    "addressable":{"state":"verified","reason":"The public source is pinned to an exact commit.","evidence":[{"kind":"integration_check","reference":"https://github.com/Lordsisodia/siso-agent-brain/commit/ed50bec86f5cfb86cc5c84ebfce97fad595598b4","observed_at":"2026-07-30","summary":"Canonical public main resolved at the importer release."}]},
    "archive_downloadable":{"state":"verified","reason":"A commit-scoped public source archive is recorded.","evidence":[{"kind":"public_locator","reference":"https://github.com/Lordsisodia/siso-agent-brain/archive/ed50bec86f5cfb86cc5c84ebfce97fad595598b4.tar.gz","observed_at":"2026-07-30","summary":"The archive locator is immutable by commit pin."}]},
    "manifest_resolvable":{"state":"verified","reason":"The release resolves to Agent Brain, the exact artifact, assessment, and importer checkpoint.","evidence":[{"kind":"release_receipt","reference":"repo-check:siso-agent-brain:ed50bec86f5cfb86cc5c84ebfce97fad595598b4","observed_at":"2026-07-30","summary":"Migration map, machine assessment, importer, HTML decision, and verification receipts agree."}]},
    "installable":{"state":"verified","reason":"Install, migrations, client, importer help, and state-preserving uninstall pass.","evidence":[{"kind":"release_receipt","reference":"repo-check:siso-agent-brain:ed50bec86f5cfb86cc5c84ebfce97fad595598b4","observed_at":"2026-07-30","summary":"Disposable package and database flows passed without deleting state."}]},
    "forkable":{"state":"verified","reason":"The repository is public, MIT licensed, source-complete, documented, and tested.","evidence":[{"kind":"source_review","reference":"https://github.com/Lordsisodia/siso-agent-brain/blob/ed50bec86f5cfb86cc5c84ebfce97fad595598b4/reports/legacy-import-checkpoint.html","observed_at":"2026-07-30","summary":"The 93/100 checkpoint records mapping, exclusions, tests, and remaining stop conditions."}]},
    "portable":{"state":"experimental","reason":"Both reviewed legacy layouts pass fixture imports; an actual local database and sustained multi-host operation remain open receipts.","evidence":[{"kind":"release_receipt","reference":"repo-check:siso-agent-brain:ed50bec86f5cfb86cc5c84ebfce97fad595598b4","observed_at":"2026-07-30","summary":"Dry-run, apply, idempotency, field mapping, invalid-event filtering, privacy opt-ins, and private path exclusion pass in isolated fixtures."}]}
  },
  "evidence":[
    {"kind":"release_receipt","reference":"repo-check:siso-agent-brain:ed50bec86f5cfb86cc5c84ebfce97fad595598b4","observed_at":"2026-07-30","summary":"Agent Brain 0.3.0 passed canonical task workflow checks plus dry-run-first Task Manager and OS Database imports with explicit capability loss rules."},
    {"kind":"source_review","reference":"https://github.com/Lordsisodia/siso-agent-brain/blob/ed50bec86f5cfb86cc5c84ebfce97fad595598b4/tools/import_legacy_tasks.py","observed_at":"2026-07-30","summary":"The source opens legacy databases read-only, uses an explicit target allowlist, defaults to rollback, and requires opt-in for memory or timeline content."}
  ]
}
