{
  "schema_version":"1.0.0","record_type":"release","id":"gls:release:789e157f-4eaf-45a5-b487-9b8f02ff407a","work_id":"gls:work:231aab36-e763-4374-bc94-3a09fd3bf49f","version":"0.1.0+6ffba38","title":"SISO Evidence Engines public package family","released_at":"2026-07-30T06:24:26+07:00","observed_at":"2026-07-30","immutable":true,
  "artifacts":[{"id":"gls:artifact:e87d23b8-fde8-437c-8cf0-88acecbae4be","kind":"source_archive","locator":"https://github.com/Lordsisodia/siso-evidence-engines/archive/6ffba38d77409d6317733ec5fe96386d0481d2ea.tar.gz","revision":"6ffba38d77409d6317733ec5fe96386d0481d2ea","availability":"public","owner":"Lordsisodia","ownership":"siso","license":{"status":"verified","spdx":"MIT","reason":"The clean SISO-owned engine family carries an MIT license.","evidence":[{"kind":"source_review","reference":"https://github.com/Lordsisodia/siso-evidence-engines/blob/6ffba38d77409d6317733ec5fe96386d0481d2ea/LICENSE","observed_at":"2026-07-30","summary":"MIT license is present at the pinned release; ingested sources retain their rights."}]},"integrity":{"state":"verified","algorithm":"git_commit_sha1","digest":"6ffba38d77409d6317733ec5fe96386d0481d2ea"}}],
  "distribution":{"addressable":{"state":"verified","reason":"Public source is pinned to an exact commit.","evidence":[{"kind":"integration_check","reference":"https://github.com/Lordsisodia/siso-evidence-engines/commit/6ffba38d77409d6317733ec5fe96386d0481d2ea","observed_at":"2026-07-30","summary":"Canonical public commit resolves."}]},"archive_downloadable":{"state":"verified","reason":"A commit-scoped public archive is recorded.","evidence":[{"kind":"release_receipt","reference":"repo-check:siso-evidence-engines:6ffba38d77409d6317733ec5fe96386d0481d2ea","observed_at":"2026-07-30","summary":"Pinned source, full CLI flow, engine gates, and publication checks passed."}]},"manifest_resolvable":{"state":"verified","reason":"The release resolves to its stable Work, engine registry, and artifact.","evidence":[{"kind":"release_receipt","reference":"repo-check:siso-evidence-engines:6ffba38d77409d6317733ec5fe96386d0481d2ea","observed_at":"2026-07-30","summary":"Pinned source, full CLI flow, engine gates, and publication checks passed."}]},"installable":{"state":"experimental","reason":"The dependency-free source CLI works; a built-wheel receipt is not yet recorded.","evidence":[{"kind":"release_receipt","reference":"repo-check:siso-evidence-engines:6ffba38d77409d6317733ec5fe96386d0481d2ea","observed_at":"2026-07-30","summary":"Pinned source, full CLI flow, engine gates, and publication checks passed."}]},"forkable":{"state":"verified","reason":"Public MIT source includes three engine contracts, shared core, fixtures, architecture, provenance, CLI, and tests.","evidence":[{"kind":"release_receipt","reference":"repo-check:siso-evidence-engines:6ffba38d77409d6317733ec5fe96386d0481d2ea","observed_at":"2026-07-30","summary":"Pinned source, full CLI flow, engine gates, and publication checks passed."}]},"portable":{"state":"verified","reason":"The full CLI flow passed in a temporary database without corpora, provider keys, or network access.","evidence":[{"kind":"release_receipt","reference":"repo-check:siso-evidence-engines:6ffba38d77409d6317733ec5fe96386d0481d2ea","observed_at":"2026-07-30","summary":"Grounding, rejection gates, canonical principles, queued ideas, export, and publication checks passed."}]}},
  "evidence":[{"kind":"release_receipt","reference":"repo-check:siso-evidence-engines:6ffba38d77409d6317733ec5fe96386d0481d2ea","observed_at":"2026-07-30","summary":"System and publication checks passed; checkpoint rated 94/100."}]
}
