{
  "schema_version": "1.0.0", "record_type": "release", "id": "gls:release:24c1ed1d-4437-4641-83e2-048d55116590", "work_id": "gls:work:2fa08dac-937a-44d3-a547-f16ac28c4e25",
  "version": "1.0.0", "title": "Research section V1", "released_at": "2026-07-30T00:00:00Z", "observed_at": "2026-07-30", "immutable": true, "artifacts": [],
  "distribution": {
    "addressable": { "state": "verified", "reason": "The section is addressable by stable registry ID.", "evidence": [{ "kind": "registry_validation", "reference": "registry:release:research-v1", "observed_at": "2026-07-30", "summary": "Release-to-Work resolution validated." }] },
    "archive_downloadable": { "state": "not_applicable", "reason": "This curated section has no independent payload archive.", "evidence": [] },
    "manifest_resolvable": { "state": "verified", "reason": "The release manifest resolves inside the registry.", "evidence": [{ "kind": "registry_validation", "reference": "registry:release:research-v1", "observed_at": "2026-07-30", "summary": "Manifest and Work reference validated." }] },
    "installable": { "state": "not_applicable", "reason": "A curated section is not software.", "evidence": [] },
    "forkable": { "state": "not_applicable", "reason": "No source payload is attached to this section release.", "evidence": [] },
    "portable": { "state": "not_applicable", "reason": "Portability is evaluated on the section's member releases.", "evidence": [] }
  },
  "evidence": [{ "kind": "documentation", "reference": "decision:great-library:research-section:2026-07-30", "observed_at": "2026-07-30", "summary": "Research was accepted as a first-class versioned Library section." }]
}
