{
  "schema_version": "1.0.0",
  "record_type": "release",
  "id": "gls:release:ebfffcbc-fa33-498f-9b81-c81bb96e12a8",
  "work_id": "gls:work:54a52e52-dfbd-4922-8c04-ec02f7fae943",
  "version": "0.4.1+bfa88dc",
  "title": "SISO Project OS repository spine and GitHub template",
  "released_at": "2026-09-06T01:50:00+07:00",
  "observed_at": "2026-09-06",
  "immutable": true,
  "artifacts": [
    {
      "id": "gls:artifact:bb2dc835-3452-44fd-a208-035b01401c0e",
      "kind": "source_archive",
      "locator": "https://github.com/sisodias/siso-project-os/archive/bfa88dc3060f59b1372c74699fe7f74a2ef1bb36.tar.gz",
      "revision": "bfa88dc3060f59b1372c74699fe7f74a2ef1bb36",
      "availability": "public",
      "owner": "sisodias",
      "ownership": "siso",
      "license": {
        "status": "verified",
        "spdx": "MIT",
        "reason": "The SISO-owned source retains its reviewed MIT license; external assets retain their own rights.",
        "evidence": [
          {
            "kind": "source_review",
            "reference": "https://github.com/sisodias/siso-project-os/blob/bfa88dc3060f59b1372c74699fe7f74a2ef1bb36/LICENSE",
            "observed_at": "2026-09-06",
            "summary": "MIT license text read from the exact published source."
          }
        ]
      },
      "integrity": {
        "state": "verified",
        "algorithm": "git_commit_sha1",
        "digest": "bfa88dc3060f59b1372c74699fe7f74a2ef1bb36"
      }
    }
  ],
  "distribution": {
    "addressable": {
      "state": "verified",
      "reason": "Exact public source commit is recorded.",
      "evidence": [
        {
          "kind": "integration_check",
          "reference": "https://github.com/sisodias/siso-project-os/commit/bfa88dc3060f59b1372c74699fe7f74a2ef1bb36",
          "observed_at": "2026-09-06",
          "summary": "Public GitHub commit resolved at the exact source pin."
        }
      ]
    },
    "archive_downloadable": {
      "state": "verified",
      "reason": "Commit-scoped source archive returned HTTP 200.",
      "evidence": [
        {
          "kind": "public_locator",
          "reference": "https://codeload.github.com/sisodias/siso-project-os/tar.gz/bfa88dc3060f59b1372c74699fe7f74a2ef1bb36",
          "observed_at": "2026-09-06",
          "summary": "The exact public source archive was fetched successfully."
        }
      ]
    },
    "manifest_resolvable": {
      "state": "verified",
      "reason": "Manifest identifies its stable Work and exact source artifact.",
      "evidence": [
        {
          "kind": "registry_validation",
          "reference": "registry/releases/siso-project-os-bfa88dc.json",
          "observed_at": "2026-09-06",
          "summary": "References and artifact pin are checked by the Library verification gate."
        }
      ]
    },
    "installable": {
      "state": "verified",
      "reason": "Clean and existing project adoption passed, with collision-preserving spine installation.",
      "evidence": [
        {
          "kind": "release_receipt",
          "reference": "repo-check:siso-project-os:bfa88dc3060f59b1372c74699fe7f74a2ef1bb36",
          "observed_at": "2026-09-06",
          "summary": "46 tests, 42-schema self-check and greenfield/existing-project adoption smoke passed. The published v0.4.1 package includes PAGE.md, HANDOFF.md, repos.json, owners.log, page.url and intake; GitHub is_template is true. The separate v0.5.0 fleet-pack tag remains unchanged."
        }
      ]
    },
    "forkable": {
      "state": "verified",
      "reason": "The exact public SISO source retains MIT licensing.",
      "evidence": [
        {
          "kind": "source_review",
          "reference": "https://github.com/sisodias/siso-project-os/blob/bfa88dc3060f59b1372c74699fe7f74a2ef1bb36/LICENSE",
          "observed_at": "2026-09-06",
          "summary": "MIT license text read from the exact published source."
        }
      ]
    },
    "portable": {
      "state": "verified",
      "reason": "Node 20+ without runtime dependencies; adoption, preservation, lifecycle, upgrade and rollback tests passed.",
      "evidence": [
        {
          "kind": "release_receipt",
          "reference": "repo-check:siso-project-os:bfa88dc3060f59b1372c74699fe7f74a2ef1bb36",
          "observed_at": "2026-09-06",
          "summary": "46 tests, 42-schema self-check and greenfield/existing-project adoption smoke passed. The published v0.4.1 package includes PAGE.md, HANDOFF.md, repos.json, owners.log, page.url and intake; GitHub is_template is true. The separate v0.5.0 fleet-pack tag remains unchanged."
        }
      ]
    }
  },
  "evidence": [
    {
      "kind": "integration_check",
      "reference": "https://github.com/sisodias/siso-project-os/commit/bfa88dc3060f59b1372c74699fe7f74a2ef1bb36",
      "observed_at": "2026-09-06",
      "summary": "Public GitHub commit resolved at the exact source pin."
    },
    {
      "kind": "release_receipt",
      "reference": "repo-check:siso-project-os:bfa88dc3060f59b1372c74699fe7f74a2ef1bb36",
      "observed_at": "2026-09-06",
      "summary": "46 tests, 42-schema self-check and greenfield/existing-project adoption smoke passed. The published v0.4.1 package includes PAGE.md, HANDOFF.md, repos.json, owners.log, page.url and intake; GitHub is_template is true. The separate v0.5.0 fleet-pack tag remains unchanged."
    }
  ]
}
