{
  "schema_version":"1.0.0","record_type":"release","id":"gls:release:a5e56fcf-e19d-4ead-8c7d-9660d41ed47e","work_id":"gls:work:3b4c4fa6-31f2-4cfc-9542-00f32e200621",
  "version":"registry-seed-2026-08-01","title":"GQ-008 publication-safe metadata seed","released_at":"2026-08-01T22:35:00+07:00","observed_at":"2026-08-01","immutable":true,"artifacts":[],
  "distribution":{
    "addressable":{"state":"verified","reason":"The question is addressable by stable Work ID and Library URL.","evidence":[{"kind":"registry_validation","reference":"registry:release:frontier-question-gq-008-seed","observed_at":"2026-08-01","summary":"The metadata manifest and question Work reference validated."}]},
    "archive_downloadable":{"state":"unavailable","reason":"No publication-safe answer archive is attached to this metadata seed.","evidence":[]},
    "manifest_resolvable":{"state":"verified","reason":"The metadata manifest resolves inside the registry.","evidence":[{"kind":"registry_validation","reference":"registry:release:frontier-question-gq-008-seed","observed_at":"2026-08-01","summary":"The release-to-Work reference and research contract validated."}]},
    "installable":{"state":"not_applicable","reason":"A research question is not software.","evidence":[]},
    "forkable":{"state":"not_applicable","reason":"No source payload is attached to this metadata seed.","evidence":[]},
    "portable":{"state":"not_applicable","reason":"Question identity is portable through registry metadata; answer artifacts are evaluated separately.","evidence":[]}
  },
  "evidence":[{"kind":"source_review","reference":"source-review:frontier-question-intake:gq-008:2026-08-01","observed_at":"2026-08-01","summary":"Only publication-safe question metadata was accepted; the benchmark campaign answer awaits artifact-level rights review."}]
}
