{
  "schema_version": "1.0.0",
  "record_type": "release",
  "id": "gls:release:7e775112-82ee-44d7-9d41-2a22bb471508",
  "work_id": "gls:work:9b18cc64-7d5e-4f30-b63d-a0ec30c1f7e1",
  "version": "0.6.0+100f07c",
  "title": "SISO mission and question-driven research architecture",
  "released_at": "2026-08-01T23:01:50+07:00",
  "observed_at": "2026-08-01",
  "immutable": true,
  "artifacts": [
    {
      "id": "gls:artifact:7f2e2428-45d7-46af-a013-0e7a5816da6c",
      "kind": "source_archive",
      "locator": "https://github.com/Lordsisodia/great-library-of-siso/archive/100f07cda65efbced0f6792e37df1854ee509e63.tar.gz",
      "revision": "100f07cda65efbced0f6792e37df1854ee509e63",
      "availability": "public",
      "owner": "Lordsisodia",
      "ownership": "siso",
      "license": {
        "status": "verified",
        "spdx": "MIT",
        "reason": "The pinned public registry source carries an MIT license.",
        "evidence": [
          {
            "kind": "source_review",
            "reference": "https://github.com/Lordsisodia/great-library-of-siso/blob/100f07cda65efbced0f6792e37df1854ee509e63/LICENSE",
            "observed_at": "2026-08-01",
            "summary": "The MIT license is present in the pinned source release."
          }
        ]
      },
      "integrity": {
        "state": "verified",
        "algorithm": "git_commit_sha1",
        "digest": "100f07cda65efbced0f6792e37df1854ee509e63"
      }
    }
  ],
  "distribution": {
    "addressable": {
      "state": "verified",
      "reason": "The public registry source is pinned to the exact mission and question-architecture commit.",
      "evidence": [
        {
          "kind": "integration_check",
          "reference": "https://github.com/Lordsisodia/great-library-of-siso/commit/100f07cda65efbced0f6792e37df1854ee509e63",
          "observed_at": "2026-08-01",
          "summary": "The published source commit resolves from the canonical repository."
        }
      ]
    },
    "archive_downloadable": {
      "state": "verified",
      "reason": "A public commit-scoped source archive is recorded.",
      "evidence": [
        {
          "kind": "public_locator",
          "reference": "https://github.com/Lordsisodia/great-library-of-siso/archive/100f07cda65efbced0f6792e37df1854ee509e63.tar.gz",
          "observed_at": "2026-08-01",
          "summary": "The archive locator is immutable by commit pin."
        }
      ]
    },
    "manifest_resolvable": {
      "state": "verified",
      "reason": "The Library builds and verifies the mission, question architecture, reusable dossier, CRM example, navigation, links, and publication contract from public source.",
      "evidence": [
        {
          "kind": "registry_validation",
          "reference": "repo-check:great-library-mission-questions:100f07c",
          "observed_at": "2026-08-01",
          "summary": "All Great Library gates passed with forty-six HTML pages, fifty-four published files, and explicit mission, first-principles-loop, and CRM contract markers."
        }
      ]
    },
    "installable": {
      "state": "verified",
      "reason": "A clean Node installation deterministically validates and builds the static mission and research surfaces.",
      "evidence": [
        {
          "kind": "release_receipt",
          "reference": "repo-check:great-library-mission-questions:100f07c",
          "observed_at": "2026-08-01",
          "summary": "Immutable history, promotion and intelligence contracts, registry validation, build, links, identity, and publication checks passed."
        }
      ]
    },
    "forkable": {
      "state": "verified",
      "reason": "The registry repository is public, source-complete, machine-readable, and MIT licensed.",
      "evidence": [
        {
          "kind": "integration_check",
          "reference": "https://github.com/Lordsisodia/great-library-of-siso",
          "observed_at": "2026-08-01",
          "summary": "Public source includes the authored modules, generator integration, verification contract, registry records, and generated site."
        }
      ]
    },
    "portable": {
      "state": "verified",
      "reason": "The published module contains no private corpus, machine-local path, client detail, or dependency on a specific model or provider.",
      "evidence": [
        {
          "kind": "release_receipt",
          "reference": "repo-check:great-library-mission-questions:100f07c",
          "observed_at": "2026-08-01",
          "summary": "The publication scan passed across the complete repository and generated site."
        }
      ]
    }
  },
  "evidence": [
    {
      "kind": "release_receipt",
      "reference": "repo-check:great-library-mission-questions:100f07c",
      "observed_at": "2026-08-01",
      "summary": "The Library now publishes a public-safe SISO mission, a ten-pass question-driven research loop, a revisable assumption dependency model, a targeted books workflow, a reusable Frontier Question dossier, and a composable-CRM worked example."
    }
  ]
}
